{
  "schemaVersion": 1,
  "id": "erm.receivers.mp",
  "kind": "article",
  "section": "erm",
  "slug": "receivers/mp",
  "status": "published",
  "sourceRefs": [
    "old-help:rec-mp.htm",
    "old-help:rec-mp-era.htm"
  ],
  "keywords": [
    "MP",
    "!!MP",
    "MP:C?z",
    "MP:P^name^/",
    "MP:P0/",
    "MP:R",
    "MP:S",
    "MP:Legacy C / P / S"
  ],
  "questions": [
    "Ресивер MP: музыка mp3, параметры команд и ограничения.",
    "MP receiver: mp3 music, command parameters, and limitations."
  ],
  "previous": null,
  "next": null,
  "sectionSources": {
    "syntax": [
      "old-help:rec-mp.htm",
      "old-help:rec-mp-era.htm"
    ],
    "command-c-z": [
      "old-help:rec-mp.htm",
      "old-help:rec-mp-era.htm"
    ],
    "command-p-name-1-2": [
      "old-help:rec-mp.htm",
      "old-help:rec-mp-era.htm"
    ],
    "command-p0": [
      "old-help:rec-mp.htm",
      "old-help:rec-mp-era.htm"
    ],
    "command-r": [
      "old-help:rec-mp.htm",
      "old-help:rec-mp-era.htm"
    ],
    "command-s-1-2-3": [
      "old-help:rec-mp.htm",
      "old-help:rec-mp-era.htm"
    ],
    "command-legacy-c-p-s": [
      "old-help:rec-mp.htm",
      "old-help:rec-mp-era.htm"
    ],
    "notes": [
      "old-help:rec-mp.htm",
      "old-help:rec-mp-era.htm"
    ],
    "related": [
      "old-help:rec-mp.htm",
      "old-help:rec-mp-era.htm"
    ],
    "reference-links": [
      "old-help:rec-mp.htm",
      "old-help:rec-mp-era.htm"
    ],
    "ref-rec-mp": [
      "old-help:rec-mp.htm"
    ],
    "ref-rec-mp-era": [
      "old-help:rec-mp-era.htm"
    ]
  }
}
