{
  "schemaVersion": 1,
  "id": "erm.triggers.cm",
  "kind": "article",
  "section": "erm",
  "slug": "triggers/cm",
  "status": "published",
  "sourceRefs": [
    "old-help:tr-cm.htm",
    "era-source:erm.pas",
    "era-changelog:era-iii-changelog.txt"
  ],
  "keywords": [
    "CM",
    "!?CM",
    "OnAdventureMapRightMouseClick",
    "OnTownMouseClick",
    "OnHeroScreenMouseClick",
    "OnHeroesMeetScreenMouseClick",
    "OnBattleScreenMouseClick",
    "OnAdventureMapLeftMouseClick"
  ],
  "questions": [
    "0 — правая кнопка на карте; 1 город; 2 герой; 3 встреча героев; 4 бой; 5 левая кнопка на карте. Координаты, элемент и действие доступны через CM.",
    "0 adventure-map right click; 1 town; 2 hero; 3 hero meeting; 4 battle; 5 adventure-map left click. CM provides coordinates, item, and action."
  ],
  "previous": null,
  "next": null,
  "sectionSources": {
    "event": [
      "old-help:tr-cm.htm",
      "era-source:erm.pas",
      "era-changelog:era-iii-changelog.txt"
    ],
    "syntax": [
      "old-help:tr-cm.htm",
      "era-source:erm.pas",
      "era-changelog:era-iii-changelog.txt"
    ],
    "names": [
      "old-help:tr-cm.htm",
      "era-source:erm.pas",
      "era-changelog:era-iii-changelog.txt"
    ],
    "limits": [
      "old-help:tr-cm.htm",
      "era-source:erm.pas",
      "era-changelog:era-iii-changelog.txt"
    ],
    "related": [
      "old-help:tr-cm.htm",
      "era-source:erm.pas",
      "era-changelog:era-iii-changelog.txt"
    ],
    "reference-links": [
      "old-help:tr-cm.htm",
      "era-source:erm.pas",
      "era-changelog:era-iii-changelog.txt"
    ],
    "ref-tr-cm": [
      "old-help:tr-cm.htm"
    ],
    "era3-updates": [
      "era-changelog:era-iii-changelog.txt"
    ]
  }
}
