{
  "schemaVersion": 1,
  "id": "erm.receivers.ma",
  "kind": "article",
  "section": "erm",
  "slug": "receivers/ma",
  "status": "published",
  "sourceRefs": [
    "old-help:rec-ma.htm",
    "era-changelog:era-iii-changelog.txt"
  ],
  "keywords": [
    "MA",
    "!!MA",
    "MA:A",
    "MA:B",
    "MA:D",
    "MA:E",
    "MA:F",
    "MA:G",
    "MA:H",
    "MA:I",
    "MA:L",
    "MA:M",
    "MA:N",
    "MA:O",
    "MA:P",
    "MA:R",
    "MA:S",
    "MA:V",
    "MA:X",
    "MA:C",
    "MA:U"
  ],
  "questions": [
    "Ресивер MA: параметры типов существ, параметры команд и ограничения.",
    "MA receiver: creature-type attributes, command parameters, and limitations."
  ],
  "previous": null,
  "next": null,
  "sectionSources": {
    "syntax": [
      "old-help:rec-ma.htm"
    ],
    "command-a": [
      "old-help:rec-ma.htm"
    ],
    "command-b": [
      "old-help:rec-ma.htm"
    ],
    "command-d": [
      "old-help:rec-ma.htm"
    ],
    "command-e": [
      "old-help:rec-ma.htm"
    ],
    "command-f": [
      "old-help:rec-ma.htm"
    ],
    "command-g": [
      "old-help:rec-ma.htm"
    ],
    "command-h": [
      "old-help:rec-ma.htm"
    ],
    "command-i": [
      "old-help:rec-ma.htm"
    ],
    "command-l": [
      "old-help:rec-ma.htm"
    ],
    "command-m": [
      "old-help:rec-ma.htm"
    ],
    "command-n": [
      "old-help:rec-ma.htm"
    ],
    "command-o": [
      "old-help:rec-ma.htm"
    ],
    "command-p": [
      "old-help:rec-ma.htm"
    ],
    "command-r": [
      "old-help:rec-ma.htm"
    ],
    "command-s": [
      "old-help:rec-ma.htm"
    ],
    "command-v": [
      "old-help:rec-ma.htm"
    ],
    "command-x": [
      "old-help:rec-ma.htm"
    ],
    "command-c-1-2": [
      "old-help:rec-ma.htm"
    ],
    "command-u": [
      "old-help:rec-ma.htm"
    ],
    "notes": [
      "old-help:rec-ma.htm"
    ],
    "related": [
      "old-help:rec-ma.htm"
    ],
    "reference-links": [
      "old-help:rec-ma.htm"
    ],
    "ref-rec-ma": [
      "old-help:rec-ma.htm"
    ],
    "era3-updates": [
      "era-changelog:era-iii-changelog.txt"
    ]
  }
}
