{
  "schemaVersion": 1,
  "id": "erm.framework.functions.onadventuremaprightmouseclick-quit",
  "kind": "article",
  "section": "erm",
  "slug": "framework/functions/onadventuremaprightmouseclick-quit",
  "status": "published",
  "sourceRefs": [
    "era-framework:lib-end--9999-era---stdlib.erm:lines-37-39-onadventuremaprightmouseclick-quit"
  ],
  "keywords": [
    "OnAdventureMapRightMouseClick_Quit",
    "FU(OnAdventureMapRightMouseClick_Quit)",
    "quit-handler",
    "events"
  ],
  "questions": [
    "Завершающий обработчик OnAdventureMapRightMouseClick: выполняет перечисленные ниже вызовы после основной цепочки. Не вызывайте его вручную: он завершает контекст Framework.",
    "Final handler for OnAdventureMapRightMouseClick: performs the calls listed below after the main chain. Do not invoke it manually; it closes Framework context."
  ],
  "previous": null,
  "next": null,
  "sectionSources": {
    "purpose": [
      "era-framework:lib-end--9999-era---stdlib.erm:lines-37-39-onadventuremaprightmouseclick-quit"
    ],
    "signature": [
      "era-framework:lib-end--9999-era---stdlib.erm:lines-37-39-onadventuremaprightmouseclick-quit"
    ],
    "context": [
      "era-framework:lib-end--9999-era---stdlib.erm:lines-37-39-onadventuremaprightmouseclick-quit"
    ],
    "calls": [
      "era-framework:lib-end--9999-era---stdlib.erm:lines-37-39-onadventuremaprightmouseclick-quit"
    ],
    "provenance": [
      "era-framework:lib-end--9999-era---stdlib.erm:lines-37-39-onadventuremaprightmouseclick-quit"
    ]
  }
}
