{
  "schemaVersion": 1,
  "id": "erm.receivers.st",
  "kind": "article",
  "section": "erm",
  "slug": "receivers/st",
  "status": "published",
  "sourceRefs": [
    "old-help:rec-st.htm"
  ],
  "keywords": [
    "ST",
    "!!ST",
    "ST:N"
  ],
  "questions": [
    "Ресивер ST: камень знаний, параметры команд и ограничения.",
    "ST receiver: learning stone, command parameters, and limitations."
  ],
  "previous": null,
  "next": null,
  "sectionSources": {
    "syntax": [
      "old-help:rec-st.htm"
    ],
    "command-n": [
      "old-help:rec-st.htm"
    ],
    "notes": [
      "old-help:rec-st.htm"
    ],
    "related": [
      "old-help:rec-st.htm"
    ],
    "reference-links": [
      "old-help:rec-st.htm"
    ],
    "ref-rec-st": [
      "old-help:rec-st.htm"
    ]
  }
}
