{
  "schemaVersion": 1,
  "id": "wiki.sprite.2.6.page-6",
  "kind": "article",
  "section": "wiki",
  "slug": "sprite/2/6/page-6",
  "status": "published",
  "sourceRefs": [
    "wiki-sod:H3sprite.lf",
    "wiki-sod:H3sprite.lod"
  ],
  "keywords": [
    "SoD",
    "H3sprite.lod",
    "Игровой интерфейс, здания",
    "Game interface and buildings"
  ],
  "questions": [
    "Какие ресурсы содержит Игровой интерфейс, здания?",
    "Which files are in Game interface and buildings?"
  ],
  "previous": "sprite/2/6/page-5",
  "next": "sprite/2/6/page-7"
}
