{
  "schemaVersion": 1,
  "id": "wiki.sprite.2.2.page-3",
  "kind": "article",
  "section": "wiki",
  "slug": "sprite/2/2/page-3",
  "status": "published",
  "sourceRefs": [
    "wiki-sod:H3sprite.lf",
    "wiki-sod:H3sprite.lod"
  ],
  "keywords": [
    "SoD",
    "H3sprite.lod",
    "Объекты на карте",
    "Map objects"
  ],
  "questions": [
    "Какие ресурсы содержит Объекты на карте?",
    "Which files are in Map objects?"
  ],
  "previous": "sprite/2/2/page-2",
  "next": "sprite/2/2/page-4"
}
