{
  "schemaVersion": 1,
  "id": "wiki.sounds.page-15",
  "kind": "article",
  "section": "wiki",
  "slug": "sounds/page-15",
  "status": "published",
  "sourceRefs": [
    "wiki-sod:Heroes3.snd"
  ],
  "keywords": [
    "SoD",
    "Heroes3.snd",
    "Звуки",
    "Sounds"
  ],
  "questions": [
    "Какие ресурсы содержит Звуки?",
    "Which files are in Sounds?"
  ],
  "previous": "sounds/page-14",
  "next": null
}
