{
  "schemaVersion": 1,
  "id": "wiki.bitmap.0.0.page-11",
  "kind": "article",
  "section": "wiki",
  "slug": "bitmap/0/0/page-11",
  "status": "published",
  "sourceRefs": [
    "wiki-sod:H3bitmap.lf",
    "wiki-sod:H3bitmap.lod"
  ],
  "keywords": [
    "SoD",
    "H3bitmap.lod",
    "Элементы городов",
    "Town elements"
  ],
  "questions": [
    "Какие ресурсы содержит Элементы городов?",
    "Which files are in Town elements?"
  ],
  "previous": "bitmap/0/0/page-10",
  "next": "bitmap/0/0/page-12"
}
