{
  "schemaVersion": 1,
  "id": "erm.framework.functions.ontownmousehint-quit",
  "kind": "article",
  "section": "erm",
  "slug": "framework/functions/ontownmousehint-quit",
  "status": "published",
  "sourceRefs": [
    "era-framework:lib-end--9999-era---stdlib.erm:lines-67-69-ontownmousehint-quit"
  ],
  "keywords": [
    "OnTownMouseHint_Quit",
    "FU(OnTownMouseHint_Quit)",
    "quit-handler",
    "events"
  ],
  "questions": [
    "Завершающий обработчик OnTownMouseHint: выполняет перечисленные ниже вызовы после основной цепочки. Не вызывайте его вручную: он завершает контекст Framework.",
    "Final handler for OnTownMouseHint: performs the calls listed below after the main chain. Do not invoke it manually; it closes Framework context."
  ],
  "previous": null,
  "next": null,
  "sectionSources": {
    "purpose": [
      "era-framework:lib-end--9999-era---stdlib.erm:lines-67-69-ontownmousehint-quit"
    ],
    "signature": [
      "era-framework:lib-end--9999-era---stdlib.erm:lines-67-69-ontownmousehint-quit"
    ],
    "context": [
      "era-framework:lib-end--9999-era---stdlib.erm:lines-67-69-ontownmousehint-quit"
    ],
    "calls": [
      "era-framework:lib-end--9999-era---stdlib.erm:lines-67-69-ontownmousehint-quit"
    ],
    "provenance": [
      "era-framework:lib-end--9999-era---stdlib.erm:lines-67-69-ontownmousehint-quit"
    ]
  }
}
