{
  "schemaVersion": 1,
  "id": "erm.framework.functions.radiodlg-settitle",
  "kind": "article",
  "section": "erm",
  "slug": "framework/functions/radiodlg-settitle",
  "status": "published",
  "sourceRefs": [
    "era-framework:lib-9999-era---stdlib.erm:lines-2468-2473-radiodlg-settitle"
  ],
  "keywords": [
    "RadioDlg_SetTitle",
    "FU(RadioDlg_SetTitle)",
    "public",
    "dialogs"
  ],
  "questions": [
    "Копирует заголовок в состояние радиодиалога.",
    "Copies the title into radio-dialog state."
  ],
  "previous": null,
  "next": null,
  "sectionSources": {
    "purpose": [
      "era-framework:lib-9999-era---stdlib.erm:lines-2468-2473-radiodlg-settitle"
    ],
    "signature": [
      "era-framework:lib-9999-era---stdlib.erm:lines-2468-2473-radiodlg-settitle"
    ],
    "parameters": [
      "era-framework:lib-9999-era---stdlib.erm:lines-2468-2473-radiodlg-settitle"
    ],
    "context": [
      "era-framework:lib-9999-era---stdlib.erm:lines-2468-2473-radiodlg-settitle"
    ],
    "provenance": [
      "era-framework:lib-9999-era---stdlib.erm:lines-2468-2473-radiodlg-settitle"
    ]
  }
}
