{
  "schemaVersion": 1,
  "id": "erm.tables.projectiles",
  "kind": "article",
  "section": "erm",
  "slug": "tables/projectiles",
  "status": "published",
  "sourceRefs": [
    "old-help:form-weapon.htm"
  ],
  "keywords": [
    "Снаряды и лучи",
    "Projectiles and beams",
    "projectiles"
  ],
  "questions": [
    "Тип изображения выстрела отличается от типа существа и флага стрелка.",
    "A projectile image type differs from creature type and shooter flags."
  ],
  "previous": null,
  "next": null,
  "sectionSources": {
    "meaning": [
      "old-help:form-weapon.htm"
    ],
    "values": [
      "old-help:form-weapon.htm"
    ],
    "limits": [
      "old-help:form-weapon.htm"
    ],
    "related": [
      "old-help:form-weapon.htm"
    ],
    "reference-links": [
      "old-help:form-weapon.htm"
    ],
    "ref-form-weapon": [
      "old-help:form-weapon.htm"
    ]
  }
}
