{
  "schemaVersion": 1,
  "id": "wiki.bitmap.0.1.page-35",
  "kind": "article",
  "section": "wiki",
  "slug": "bitmap/0/1/page-35",
  "status": "published",
  "sourceRefs": [
    "wiki-sod:H3bitmap.lf",
    "wiki-sod:H3bitmap.lod",
    "wiki-ab:Camp1AB7.bmp",
    "wiki-ab:Camp1DB2.bmp",
    "wiki-ab:Camp1DS1.bmp",
    "wiki-ab:Camp1FL3.bmp",
    "wiki-ab:Camp1PF2.bmp",
    "wiki-ab:Camp1FW1.bmp"
  ],
  "keywords": [
    "SoD",
    "Элементы кампаний",
    "Campaign elements"
  ],
  "questions": [
    "Какие ресурсы содержит Элементы кампаний?",
    "Which files are in Campaign elements?"
  ],
  "previous": "bitmap/0/1/page-34",
  "next": "bitmap/0/1/page-36"
}
