{
  "schemaVersion": 1,
  "id": "erm.receivers.ea",
  "kind": "article",
  "section": "erm",
  "slug": "receivers/ea",
  "status": "published",
  "sourceRefs": [
    "old-help:rec-ea.htm",
    "old-help:cont-stackexpbonus.htm",
    "era-changelog:era-iii-changelog.txt"
  ],
  "keywords": [
    "EA",
    "!!EA",
    "EA:A",
    "EA:B",
    "EA:C",
    "EA:D?",
    "EA:E",
    "EA:F",
    "EA:O",
    "EA:R"
  ],
  "questions": [
    "Ресивер EA: опыт и бонусы существ, параметры команд и ограничения.",
    "EA receiver: creature experience and bonuses, command parameters, and limitations."
  ],
  "previous": null,
  "next": null,
  "sectionSources": {
    "syntax": [
      "old-help:rec-ea.htm"
    ],
    "command-a-h-s-t": [
      "old-help:rec-ea.htm"
    ],
    "command-b-2-3-4-5-15": [
      "old-help:rec-ea.htm"
    ],
    "command-c-l-m-p-u": [
      "old-help:rec-ea.htm"
    ],
    "command-d": [
      "old-help:rec-ea.htm"
    ],
    "command-e-1-2-3-4": [
      "old-help:rec-ea.htm"
    ],
    "command-f-f": [
      "old-help:rec-ea.htm"
    ],
    "command-o-mode": [
      "old-help:rec-ea.htm"
    ],
    "command-r-1-2": [
      "old-help:rec-ea.htm"
    ],
    "notes": [
      "old-help:rec-ea.htm"
    ],
    "related": [
      "old-help:rec-ea.htm"
    ],
    "reference-links": [
      "old-help:rec-ea.htm"
    ],
    "ref-rec-ea": [
      "old-help:rec-ea.htm"
    ],
    "ref-cont-stackexpbonus": [
      "old-help:cont-stackexpbonus.htm"
    ],
    "era3-updates": [
      "era-changelog:era-iii-changelog.txt"
    ]
  }
}
