{
  "schemaVersion": 1,
  "id": "erm.framework.functions.onbeforebattlestackturn",
  "kind": "article",
  "section": "erm",
  "slug": "framework/functions/onbeforebattlestackturn",
  "status": "published",
  "sourceRefs": [
    "era-framework:lib-9999-era---stdlib.erm:lines-269-274-onbeforebattlestackturn"
  ],
  "keywords": [
    "OnBeforeBattleStackTurn",
    "FU(OnBeforeBattleStackTurn)",
    "event-handler",
    "events"
  ],
  "questions": [
    "Записывает activeStack в battle_current_stack.",
    "Stores activeStack in battle_current_stack."
  ],
  "previous": null,
  "next": null,
  "sectionSources": {
    "purpose": [
      "era-framework:lib-9999-era---stdlib.erm:lines-269-274-onbeforebattlestackturn"
    ],
    "signature": [
      "era-framework:lib-9999-era---stdlib.erm:lines-269-274-onbeforebattlestackturn"
    ],
    "parameters": [
      "era-framework:lib-9999-era---stdlib.erm:lines-269-274-onbeforebattlestackturn"
    ],
    "context": [
      "era-framework:lib-9999-era---stdlib.erm:lines-269-274-onbeforebattlestackturn"
    ],
    "provenance": [
      "era-framework:lib-9999-era---stdlib.erm:lines-269-274-onbeforebattlestackturn"
    ]
  }
}
