{
  "schemaVersion": 1,
  "id": "wiki.bitmap.0.1.page-38",
  "kind": "article",
  "section": "wiki",
  "slug": "bitmap/0/1/page-38",
  "status": "published",
  "sourceRefs": [
    "wiki-sod:H3bitmap.lf",
    "wiki-sod:H3bitmap.lod"
  ],
  "keywords": [
    "SoD",
    "Элементы кампаний",
    "Campaign elements"
  ],
  "questions": [
    "Какие ресурсы содержит Элементы кампаний?",
    "Which files are in Campaign elements?"
  ],
  "previous": "bitmap/0/1/page-37",
  "next": "bitmap/0/1/page-39"
}
