{
  "schemaVersion": 1,
  "id": "erm.framework.constants.monsters",
  "kind": "article",
  "section": "erm",
  "slug": "framework/constants/monsters",
  "status": "published",
  "sourceRefs": [
    "era-framework:lib-9999-era---consts.erm"
  ],
  "keywords": [
    "NO_MON",
    "ANY_MON",
    "MON_FIRST",
    "MON_PIKEMAN",
    "MON_HALBERDIER",
    "MON_ARCHER",
    "MON_MARKSMAN",
    "MON_GRIFFIN",
    "MON_ROYAL_GRIFFIN",
    "MON_SWORDSMAN",
    "MON_CRUSADER",
    "MON_MONK",
    "MON_ZEALOT",
    "MON_CAVALIER",
    "MON_CHAMPION",
    "MON_ANGEL",
    "MON_ARCHANGEL",
    "MON_CENTAUR",
    "MON_CENTAUR_CAPTAIN",
    "MON_DWARF",
    "MON_BATTLE_DWARF",
    "MON_WOOD_ELF",
    "MON_GRAND_ELF",
    "MON_PEGASUS",
    "MON_SILVER_PEGASUS",
    "MON_DENDROID_GUARD",
    "MON_DENDROID_SOLDIER",
    "MON_UNICORN",
    "MON_WAR_UNICORN",
    "MON_GREEN_DRAGON",
    "MON_GOLD_DRAGON",
    "MON_GREMLIN",
    "MON_MASTER_GREMLIN",
    "MON_STONE_GARGOYLE",
    "MON_OBSIDIAN_GARGOYLE",
    "MON_STONE_GOLEM",
    "MON_IRON_GOLEM",
    "MON_MAGE",
    "MON_ARCH_MAGE",
    "MON_GENIE",
    "MON_MASTER_GENIE",
    "MON_NAGA",
    "MON_NAGA_QUEEN",
    "MON_GIANT",
    "MON_TITAN",
    "MON_IMP",
    "MON_FAMILIAR",
    "MON_GOG",
    "MON_MAGOG",
    "MON_HELL_HOUND",
    "MON_CERBERUS",
    "MON_DEMON",
    "MON_HORNED_DEMON",
    "MON_PIT_FIEND",
    "MON_PIT_LORD",
    "MON_EFREETI",
    "MON_EFREET_SULTAN",
    "MON_DEVIL",
    "MON_ARCH_DEVIL",
    "MON_SKELETON",
    "MON_SKELETON_WARRIOR",
    "MON_WALKING_DEAD",
    "MON_ZOMBIE",
    "MON_WIGHT",
    "MON_WRAITH",
    "MON_VAMPIRE",
    "MON_VAMPIRE_LORD",
    "MON_LICH",
    "MON_POWER_LICH",
    "MON_BLACK_KNIGHT",
    "MON_DREAD_KNIGHT",
    "MON_BONE_DRAGON",
    "MON_GHOST_DRAGON",
    "MON_TROGLODYTE",
    "MON_INFERNAL_TROGLODYTE",
    "MON_HARPY",
    "MON_HARPY_HAG",
    "MON_BEHOLDER",
    "MON_EVIL_EYE",
    "MON_MEDUSA",
    "MON_MEDUSA_QUEEN",
    "MON_MINOTAUR",
    "MON_MINOTAUR_KING",
    "MON_MANTICORE",
    "MON_SCORPICORE",
    "MON_RED_DRAGON",
    "MON_BLACK_DRAGON",
    "MON_GOBLIN",
    "MON_HOBGOBLIN",
    "MON_WOLF_RIDER",
    "MON_WOLF_RAIDER",
    "MON_ORC",
    "MON_ORC_CHIEFTAIN",
    "MON_OGRE",
    "MON_OGRE_MAGE",
    "MON_ROC",
    "MON_THUNDERBIRD",
    "MON_CYCLOPS",
    "MON_CYCLOPS_KING",
    "MON_BEHEMOTH",
    "MON_ANCIENT_BEHEMOTH",
    "MON_GNOLL",
    "MON_GNOLL_MARAUDER",
    "MON_LIZARDMAN",
    "MON_LIZARD_WARRIOR",
    "MON_GORGON",
    "MON_MIGHTY_GORGON",
    "MON_SERPENT_FLY",
    "MON_DRAGON_FLY",
    "MON_BASILISK",
    "MON_GREATER_BASILISK",
    "MON_WYVERN",
    "MON_WYVERN_MONARCH",
    "MON_HYDRA",
    "MON_CHAOS_HYDRA",
    "MON_AIR_ELEMENTAL",
    "MON_EARTH_ELEMENTAL",
    "MON_FIRE_ELEMENTAL",
    "MON_WATER_ELEMENTAL",
    "MON_GOLD_GOLEM",
    "MON_DIAMOND_GOLEM",
    "MON_PIXIE",
    "MON_SPRITE",
    "MON_PSYCHIC_ELEMENTAL",
    "MON_MAGIC_ELEMENTAL",
    "MON_NOT_USED_1",
    "MON_ICE_ELEMENTAL",
    "MON_NOT_USED_2",
    "MON_MAGMA_ELEMENTAL",
    "MON_NOT_USED_3",
    "MON_STORM_ELEMENTAL",
    "MON_NOT_USED_4",
    "MON_ENERGY_ELEMENTAL",
    "MON_FIREBIRD",
    "MON_PHOENIX",
    "MON_AZURE_DRAGON",
    "MON_CRYSTAL_DRAGON",
    "MON_FAERIE_DRAGON",
    "MON_RUST_DRAGON",
    "MON_ENCHANTER",
    "MON_SHARPSHOOTER",
    "MON_HALFLING",
    "MON_PEASANT",
    "MON_BOAR",
    "MON_MUMMY",
    "MON_NOMAD",
    "MON_ROGUE",
    "MON_TROLL",
    "MON_CATAPULT",
    "MON_BALLISTA",
    "MON_FIRST_AID_TENT",
    "MON_AMMO_CART",
    "MON_ARROW_TOWERS",
    "MON_SUPREME_ARCHANGEL",
    "MON_DIAMOND_DRAGON",
    "MON_LORD_OF_THUNDER",
    "MON_HELL_BARON",
    "MON_BLOOD_DRAGON",
    "MON_DARKNESS_DRAGON",
    "MON_GHOST_BEHEMOTH",
    "MON_HELL_HYDRA",
    "MON_SACRED_PHOENIX",
    "MON_GHOST",
    "MON_EMISSARY_OF_WAR",
    "MON_EMISSARY_OF_PEACE",
    "MON_EMISSARY_OF_MANA",
    "MON_EMISSARY_OF_LORE",
    "MON_FIRE_MESSENGER",
    "MON_EARTH_MESSENGER",
    "MON_AIR_MESSENGER",
    "MON_WATER_MESSENGER",
    "MON_GORYNYCH",
    "MON_WAR_ZEALOT",
    "MON_ARCTIC_SHARPSHOOTER",
    "MON_LAVA_SHARPSHOOTER",
    "MON_NIGHTMARE",
    "MON_SANTA_GREMLIN",
    "MON_COMMANDER_FIRST_A",
    "MON_PALADIN_A",
    "MON_HIEROPHANT_A",
    "MON_TEMPLE_GUARDIAN_A",
    "MON_SUCCUBUS_A",
    "MON_SOUL_EATER_A",
    "MON_BRUTE_A",
    "MON_OGRE_LEADER_A",
    "MON_SHAMAN_A",
    "MON_ASTRAL_SPIRIT_A",
    "MON_COMMANDER_LAST_A",
    "MON_COMMANDER_FIRST_D",
    "MON_PALADIN_D",
    "MON_HIEROPHANT_D",
    "MON_TEMPLE_GUARDIAN_D",
    "MON_SUCCUBUS_D",
    "MON_SOUL_EATER_D",
    "MON_BRUTE_D",
    "MON_OGRE_LEADER_D",
    "MON_SHAMAN_D",
    "MON_ASTRAL_SPIRIT_D",
    "MON_COMMANDER_LAST_D",
    "MON_SYLVAN_CENTAUR",
    "MON_SORCERESS",
    "MON_WEREWOLF",
    "MON_HELL_STEED",
    "MON_DRACOLICH",
    "MON_LAST_WOG"
  ],
  "questions": [
    "205 именованных значений: существа.",
    "205 named values: monsters."
  ],
  "previous": null,
  "next": null,
  "sectionSources": {
    "meaning": [
      "era-framework:lib-9999-era---consts.erm"
    ],
    "values": [
      "era-framework:lib-9999-era---consts.erm"
    ],
    "related": [
      "era-framework:lib-9999-era---consts.erm"
    ],
    "used-by": [
      "era-framework:lib-9999-era---consts.erm"
    ]
  }
}
