{
  "schemaVersion": 1,
  "id": "erm.receivers.tr",
  "kind": "article",
  "section": "erm",
  "slug": "receivers/tr",
  "status": "published",
  "sourceRefs": [
    "old-help:rec-tr.htm",
    "era-changelog:era-iii-changelog.txt"
  ],
  "keywords": [
    "TR",
    "!!TR",
    "TR:E",
    "TR:G?",
    "TR:T",
    "TR:V"
  ],
  "questions": [
    "Ресивер TR: клетки карты, параметры команд и ограничения.",
    "TR receiver: map tiles, command parameters, and limitations."
  ],
  "previous": null,
  "next": null,
  "sectionSources": {
    "syntax": [
      "old-help:rec-tr.htm"
    ],
    "command-e-p": [
      "old-help:rec-tr.htm"
    ],
    "command-g": [
      "old-help:rec-tr.htm"
    ],
    "command-t-1-2-3-4-5-6-7-8": [
      "old-help:rec-tr.htm"
    ],
    "command-v": [
      "old-help:rec-tr.htm"
    ],
    "notes": [
      "old-help:rec-tr.htm"
    ],
    "related": [
      "old-help:rec-tr.htm"
    ],
    "reference-links": [
      "old-help:rec-tr.htm"
    ],
    "ref-rec-tr": [
      "old-help:rec-tr.htm"
    ],
    "era3-updates": [
      "era-changelog:era-iii-changelog.txt"
    ]
  }
}
