{
  "schemaVersion": 1,
  "id": "erm.receivers",
  "kind": "article",
  "section": "erm",
  "slug": "receivers",
  "status": "published",
  "sourceRefs": [
    "old-help:cont-receivers.htm",
    "old-help:cont-receiversa.htm",
    "old-help:cont-receiversol.htm"
  ],
  "keywords": [
    "AI",
    "AR",
    "BA",
    "BF",
    "BG",
    "BH",
    "BM",
    "BU",
    "CA",
    "CB",
    "CD",
    "CE",
    "CH",
    "CM",
    "CO",
    "DL",
    "DO",
    "DW",
    "EA",
    "EX",
    "FC",
    "FR",
    "FU",
    "GD",
    "GE",
    "GR",
    "HE",
    "HL",
    "HO",
    "HT",
    "IF",
    "IP",
    "KT",
    "LE",
    "LN",
    "MA",
    "MC",
    "MF",
    "ML",
    "MM",
    "MN",
    "MO",
    "MP",
    "MR",
    "MT",
    "MW",
    "OB",
    "OW",
    "PA",
    "PM",
    "PO",
    "PR",
    "QU",
    "QW",
    "RD",
    "SC",
    "SG",
    "SK",
    "SN",
    "SP",
    "SR",
    "SS",
    "ST",
    "SW",
    "SY",
    "TL",
    "TM",
    "TR",
    "UN",
    "UR",
    "VC",
    "VR",
    "WG",
    "WH",
    "WM",
    "WT"
  ],
  "questions": [
    "Алфавитный каталог команд с параметрами, ограничениями и контекстом.",
    "Alphabetical command catalog with parameters, limitations and context."
  ],
  "previous": null,
  "next": null,
  "sectionSources": {
    "use": [
      "old-help:cont-receivers.htm",
      "old-help:cont-receiversa.htm",
      "old-help:cont-receiversol.htm"
    ],
    "catalog": [
      "old-help:cont-receivers.htm",
      "old-help:cont-receiversa.htm",
      "old-help:cont-receiversol.htm"
    ],
    "control": [
      "old-help:cont-receivers.htm",
      "old-help:cont-receiversa.htm",
      "old-help:cont-receiversol.htm"
    ],
    "reference-links": [
      "old-help:cont-receivers.htm",
      "old-help:cont-receiversa.htm",
      "old-help:cont-receiversol.htm"
    ],
    "ref-cont-receivers": [
      "old-help:cont-receivers.htm"
    ],
    "ref-cont-receiversa": [
      "old-help:cont-receiversa.htm"
    ]
  }
}
