{
  "schemaVersion": 1,
  "id": "erm.tables.creature-dwellings",
  "kind": "article",
  "section": "erm",
  "slug": "tables/creature-dwellings",
  "status": "published",
  "sourceRefs": [
    "old-help:form-creaturedwellings.htm",
    "old-help:rec-dw.htm"
  ],
  "keywords": [
    "Жилища существ на карте",
    "Creature dwellings on the map"
  ],
  "questions": [
    "Основная таблица — подтипы объекта 17. У объекта 20 подтип 0 — жилище четырёх элементалей, подтип 1 — фабрика четырёх големов.",
    "The main table lists subtypes of object 17. For object 20, subtype 0 is the four-elemental dwelling and subtype 1 the four-golem factory."
  ],
  "previous": null,
  "next": null,
  "sectionSources": {
    "meaning": [
      "old-help:form-creaturedwellings.htm",
      "old-help:rec-dw.htm"
    ],
    "values": [
      "old-help:form-creaturedwellings.htm",
      "old-help:rec-dw.htm"
    ],
    "related": [
      "old-help:form-creaturedwellings.htm",
      "old-help:rec-dw.htm"
    ],
    "reference-links": [
      "old-help:form-creaturedwellings.htm",
      "old-help:rec-dw.htm"
    ],
    "ref-form-creaturedwellings": [
      "old-help:form-creaturedwellings.htm"
    ]
  }
}
